{"active_policy":{"allowed_packages":["com.phone"],"baseline_launcher_package":"com.android.launcher3"},"baseline":{"baseline_id":"11111111-1111-1111-1111-111111111111","baseline_launcher_package":"com.android.launcher3","initial_home_component":"com.android.launcher3/.Launcher","initial_packages":[{"package_id":"com.phone","suspended":false,"user_id":0}]},"baseline_id":"11111111-1111-1111-1111-111111111111","checksum":"4dbe374065f143b862b9c709da2f73d8655ecf5c5f931682dd53e8994ddd1b60","device_binding":{"fingerprint":"google/pixel/test","serial":"ABC123","user_id":0},"journal":[{"id":"22222222-2222-2222-2222-222222222222","inverse":{"kind":"package_suspension","package_id":"com.social","suspended":false,"user_id":0},"operation":{"kind":"package_suspension","package_id":"com.social","suspended":true,"user_id":0},"state":"applied"},{"id":"33333333-3333-3333-3333-333333333333","inverse":{"kind":"maintenance","open":false},"operation":{"kind":"maintenance","open":true},"state":"pending"}],"maintenance":{"state":"open"},"previous_revision_hash":"166361dabebcbc5a970a3b59db4778ffce1347b1feaadb9506a53607cb713aaa","revision":3,"schema_version":"recovery-v1"}
