{"active_policy":{"allowed_packages":["com.phone"],"baseline_launcher_package":"com.android.launcher3"},"baseline":{"baseline_id":"11111111-1111-1111-1111-111111111111","baseline_launcher_package":"com.android.launcher3","initial_home_component":"com.android.launcher3/.Launcher","initial_packages":[{"package_id":"com.phone","suspended":false,"user_id":0}]},"baseline_id":"11111111-1111-1111-1111-111111111111","checksum":"bfaa54451e67cc9cf3fa537fe33c6cc6dedac12aeff6cf2b356a12402171706f","device_binding":{"fingerprint":"google/pixel/test","serial":"ABC123","user_id":0},"journal":[],"maintenance":{"state":"closed"},"previous_revision_hash":null,"revision":0,"schema_version":"recovery-v1"}
