{"active_policy":{"allowed_packages":["com.phone"],"baseline_launcher_package":"com.android.launcher3"},"baseline":{"baseline_id":"11111111-1111-1111-1111-111111111111","baseline_launcher_package":"com.android.launcher3","initial_home_component":"com.android.launcher3/.Launcher","initial_packages":[{"package_id":"com.phone","suspended":false,"user_id":0}]},"baseline_id":"11111111-1111-1111-1111-111111111111","checksum":"37f77eeb27f81d038e3eb0b49c77d5fe19591f61a1062a5e3366262d406553ef","device_binding":{"fingerprint":"google/pixel/test","serial":"ABC123","user_id":0},"journal":[{"id":"22222222-2222-2222-2222-222222222222","inverse":{"kind":"package_suspension","package_id":"com.social","suspended":false,"user_id":0},"operation":{"kind":"package_suspension","package_id":"com.social","suspended":true,"user_id":0},"state":"pending"}],"maintenance":{"state":"closed"},"previous_revision_hash":"bfaa54451e67cc9cf3fa537fe33c6cc6dedac12aeff6cf2b356a12402171706f","revision":1,"schema_version":"recovery-v1"}
