{"active_policy":{"allowed_packages":["com.phone"],"baseline_launcher_package":"com.android.launcher3"},"baseline":{"baseline_id":"11111111-1111-1111-1111-111111111111","baseline_launcher_package":"com.android.launcher3","initial_home_component":"com.android.launcher3/.Launcher","initial_packages":[{"package_id":"com.phone","suspended":false,"user_id":0}]},"baseline_id":"11111111-1111-1111-1111-111111111111","checksum":"166361dabebcbc5a970a3b59db4778ffce1347b1feaadb9506a53607cb713aaa","device_binding":{"fingerprint":"google/pixel/test","serial":"ABC123","user_id":0},"journal":[{"id":"22222222-2222-2222-2222-222222222222","inverse":{"kind":"package_suspension","package_id":"com.social","suspended":false,"user_id":0},"operation":{"kind":"package_suspension","package_id":"com.social","suspended":true,"user_id":0},"state":"applied"}],"maintenance":{"state":"closed"},"previous_revision_hash":"37f77eeb27f81d038e3eb0b49c77d5fe19591f61a1062a5e3366262d406553ef","revision":2,"schema_version":"recovery-v1"}
